{
  "$schema": "https://json-schema.org/draft/2020-12/schema",
  "title": "MilocoSettings",
  "description": "miloco 用户可配置项契约（对应 ~/.openclaw/miloco/config.json）",
  "type": "object",
  "additionalProperties": true,
  "properties": {
    "debug": {
      "type": "boolean",
      "default": false,
      "description": "是否启用调试模式：为 true 时 CLI / backend / openclaw 插件都会输出更详细的日志"
    },
    "server": {
      "type": "object",
      "additionalProperties": true,
      "description": "miloco 后端服务相关配置（HTTP 访问、token、启动用 Python 解释器）",
      "properties": {
        "url": {
          "type": "string",
          "default": "http://127.0.0.1:1810",
          "description": "CLI 与插件访问 miloco 后端的 HTTP Base URL（永远 HTTP；跨网加密走反代）"
        },
        "token": {
          "type": "string",
          "default": "",
          "description": "CLI 与插件访问后端时使用的 Bearer Token；为空时由后端首次启动自动生成"
        },
        "tls_verify": {
          "type": "boolean",
          "default": false,
          "description": "CLI 访问后端时是否校验 TLS 证书；当前 backend 永远 HTTP 故无作用，保留供未来反代场景"
        },
        "python_bin": {
          "type": "string",
          "default": "",
          "description": "用于启动 miloco-backend 的 Python 解释器绝对路径（install.sh 探测后写入）"
        },
        "tls_certfile": {
          "type": "string",
          "default": "",
          "deprecated": true,
          "description": "【已废弃】backend 永远 HTTP，跨网加密走反代+真证书；写了不生效，仅启动 warning"
        },
        "tls_keyfile": {
          "type": "string",
          "default": "",
          "deprecated": true,
          "description": "【已废弃】见 tls_certfile"
        }
      },
      "required": ["url", "token", "tls_verify", "python_bin"]
    },
    "agent": {
      "type": "object",
      "additionalProperties": true,
      "description": "agent webhook 出站调用配置（webhook 地址 + 鉴权凭据）",
      "properties": {
        "webhook_url": {
          "type": "string",
          "default": "http://127.0.0.1:18789/miloco/webhook",
          "description": "agent webhook 回调地址"
        },
        "auth_bearer": {
          "type": "string",
          "default": "",
          "description": "agent webhook 鉴权 Bearer 值；为空时不发送 Authorization 头"
        }
      },
      "required": ["webhook_url", "auth_bearer"]
    },
    "model": {
      "type": "object",
      "additionalProperties": true,
      "description": "miloco 使用的第三方多模态模型配置",
      "properties": {
        "omni": {
          "type": "object",
          "additionalProperties": true,
          "description": "多模态大模型（omni）配置，默认使用小米 MiMo",
          "properties": {
            "model": {
              "type": "string",
              "default": "xiaomi/mimo-v2.5",
              "description": "多模态模型标识（provider/model）"
            },
            "base_url": {
              "type": "string",
              "default": "https://api.xiaomimimo.com/v1",
              "description": "多模态模型服务 Base URL（需兼容 OpenAI-compatible 协议）"
            },
            "api_key": {
              "type": "string",
              "default": "",
              "description": "多模态模型 API Key；为空时视为未配置，插件与后端启动前校验"
            }
          },
          "required": ["model", "base_url", "api_key"]
        }
      },
      "required": ["omni"]
    }
  },
  "required": ["debug", "server", "agent", "model"]
}
